,name,id,label,title,value
1642,R60,1642,R60,"Edema, not elsewhere classified ",57.2
1643,R61,1643,R61,Generalized hyperhidrosis ,59.7
1644,R62,1644,R62,Lack of expected normal physiological development in childhood and adults ,77.6
1645,R63,1645,R63,Symptoms and signs concerning food and fluid intake ,86.5
1646,R64,1646,R64,Cachexia ,952
1647,R65,1647,R65,Symptoms and signs specifically associated with systemic inflammation and infection ,145
1648,R68,1648,R68,Other general symptoms and signs ,21200
1649,R69,1649,R69,"Illness, unspecified ",1580
1650,R70,1650,R70,Elevated erythrocyte sedimentation rate and abnormality of plasma viscosity ,7.81
1651,R71,1651,R71,Abnormality of red blood cells ,1180
1652,R73,1652,R73,Elevated blood glucose level ,2990
1653,R74,1653,R74,Abnormal serum enzyme levels ,994
1654,R75,1654,R75,Inconclusive laboratory evidence of human immunodeficiency virus [HIV] ,12.9
1655,R76,1655,R76,Other abnormal immunological findings in serum ,56.6
1656,R77,1656,R77,Other abnormalities of plasma proteins ,526
1657,R78,1657,R78,"Findings of drugs and other substances, not normally found in blood ",184
1658,R79,1658,R79,Other abnormal findings of blood chemistry ,629
1659,R80,1659,R80,Proteinuria ,1680
1660,R81,1660,R81,Glycosuria ,556
1661,R82,1661,R82,Other and unspecified abnormal findings in urine ,224
1662,R83,1662,R83,Abnormal findings in cerebrospinal fluid ,221
1663,R84,1663,R84,Abnormal findings in specimens from respiratory organs and thorax ,12.1
1664,R85,1664,R85,Abnormal findings in specimens from digestive organs and abdominal cavity ,12.1
1665,R86,1665,R86,Abnormal findings in specimens from male genital organs ,12.1
1666,R87,1666,R87,Abnormal findings in specimens from female genital organs ,12.2
1667,R88,1667,R88,Abnormal findings in other body fluids and substances ,41.6
1668,R89,1668,R89,"Abnormal findings in specimens from other organs, systems and tissues ",13.6
1669,R90,1669,R90,Abnormal findings on diagnostic imaging of central nervous system ,173
1670,R91,1670,R91,Abnormal findings on diagnostic imaging of lung ,557
1671,R92,1671,R92,Abnormal and inconclusive findings on diagnostic imaging of breast ,29.9
1672,R93,1672,R93,Abnormal findings on diagnostic imaging of other body structures ,222
1673,R94,1673,R94,Abnormal results of function studies ,3350
1674,R97,1674,R97,Abnormal tumor markers ,967
1675,R99,1675,R99,Ill-defined and unknown cause of mortality ,15.3
1676,S00,1676,S00,Superficial injury of head ,1840
1677,S01,1677,S01,Open wound of head ,11900
1678,S02,1678,S02,Fracture of skull and facial bones ,269
1679,S03,1679,S03,Dislocation and sprain of joints and ligaments of head ,61.7
1680,S04,1680,S04,Injury of cranial nerve ,2050
1681,S05,1681,S05,Injury of eye and orbit ,530
1682,S06,1682,S06,Intracranial injury ,1790
1683,S07,1683,S07,Crushing injury of head ,1020
1684,S08,1684,S08,Avulsion and traumatic amputation of part of head ,24.9
1685,S09,1685,S09,Other and unspecified injuries of head ,437
1686,S10,1686,S10,Superficial injury of neck ,1600
1687,S11,1687,S11,Open wound of neck ,4440
1688,S12,1688,S12,Fracture of cervical vertebra and other parts of neck ,48.5
1689,S13,1689,S13,Dislocation and sprain of joints and ligaments at neck level ,21
1690,S14,1690,S14,Injury of nerves and spinal cord at neck level ,1000
1691,S15,1691,S15,Injury of blood vessels at neck level ,1460
1692,S16,1692,S16,"Injury of muscle, fascia and tendon at neck level ",28.3
1693,S17,1693,S17,Crushing injury of neck ,457
1694,S19,1694,S19,Other specified and unspecified injuries of neck ,32.8
1695,S20,1695,S20,Superficial injury of thorax ,53
1696,S21,1696,S21,Open wound of thorax ,106
1697,S22,1697,S22,"Fracture of rib(s), sternum and thoracic spine ",12.5
1698,S23,1698,S23,Dislocation and sprain of joints and ligaments of thorax ,7.59
1699,S24,1699,S24,Injury of nerves and spinal cord at thorax level ,46.5
1700,S25,1700,S25,Injury of blood vessels of thorax ,122
1701,S26,1701,S26,Injury of heart ,23200
1702,S27,1702,S27,Injury of other and unspecified intrathoracic organs ,8.65
1703,S28,1703,S28,"Crushing injury of thorax, and traumatic amputation of part of thorax ",7.58
1704,S29,1704,S29,Other and unspecified injuries of thorax ,18.5
1705,S30,1705,S30,"Superficial injury of abdomen, lower back, pelvis and external genitals ",12
1706,S31,1706,S31,"Open wound of abdomen, lower back, pelvis and external genitals ",12.6
1707,S32,1707,S32,Fracture of lumbar spine and pelvis ,905
1708,S33,1708,S33,Dislocation and sprain of joints and ligaments of lumbar spine and pelvis ,16.9
1709,S34,1709,S34,"Injury of lumbar and sacral spinal cord and nerves at abdomen, lower back and pelvis level ",24.2
1710,S35,1710,S35,"Injury of blood vessels at abdomen, lower back and pelvis level ",42.4
1711,S36,1711,S36,Injury of intra-abdominal organs ,52.5
1712,S37,1712,S37,Injury of urinary and pelvic organs ,617
1713,S38,1713,S38,"Crushing injury and traumatic amputation of abdomen, lower back, pelvis and external genitals ",2.84
1714,S39,1714,S39,"Other and unspecified injuries of abdomen, lower back, pelvis and external genitals ",0.048
1715,S40,1715,S40,Superficial injury of shoulder and upper arm ,372
1716,S41,1716,S41,Open wound of shoulder and upper arm ,1040
1717,S42,1717,S42,Fracture of shoulder and upper arm ,2820
1718,S43,1718,S43,Dislocation and sprain of joints and ligaments of shoulder girdle ,11.8
1719,S44,1719,S44,Injury of nerves at shoulder and upper arm level ,981
1720,S45,1720,S45,Injury of blood vessels at shoulder and upper arm level ,186
1721,S46,1721,S46,"Injury of muscle, fascia and tendon at shoulder and upper arm level ",14.8
1722,S47,1722,S47,Crushing injury of shoulder and upper arm ,107
1723,S48,1723,S48,Traumatic amputation of shoulder and upper arm ,40.1
1724,S49,1724,S49,Other and unspecified injuries of shoulder and upper arm ,89.8
1725,S50,1725,S50,Superficial injury of elbow and forearm ,143
1726,S51,1726,S51,Open wound of elbow and forearm ,297
1727,S52,1727,S52,Fracture of forearm ,2200
1728,S53,1728,S53,Dislocation and sprain of joints and ligaments of elbow ,95
1729,S54,1729,S54,Injury of nerves at forearm level ,512
1730,S55,1730,S55,Injury of blood vessels at forearm level ,137
1731,S56,1731,S56,"Injury of muscle, fascia and tendon at forearm level ",17
1732,S57,1732,S57,Crushing injury of elbow and forearm ,36.7
1733,S58,1733,S58,Traumatic amputation of elbow and forearm ,32.9
1734,S59,1734,S59,Other and unspecified injuries of elbow and forearm ,45.5
1735,S60,1735,S60,"Superficial injury of wrist, hand and fingers ",121
1736,S61,1736,S61,"Open wound of wrist, hand and fingers ",937
1737,S62,1737,S62,Fracture at wrist and hand level ,1670
1738,S63,1738,S63,Dislocation and sprain of joints and ligaments at wrist and hand level ,19.5
1739,S64,1739,S64,Injury of nerves at wrist and hand level ,787
1740,S65,1740,S65,Injury of blood vessels at wrist and hand level ,187
1741,S66,1741,S66,"Injury of muscle, fascia and tendon at wrist and hand level ",21.2
1742,S67,1742,S67,"Crushing injury of wrist, hand and fingers ",69.2
1743,S68,1743,S68,"Traumatic amputation of wrist, hand and fingers ",40.4
1744,S69,1744,S69,"Other and unspecified injuries of wrist, hand and finger(s) ",8.67
1745,S70,1745,S70,Superficial injury of hip and thigh ,302
1746,S71,1746,S71,Open wound of hip and thigh ,866
1747,S72,1747,S72,Fracture of femur ,2910
1748,S73,1748,S73,Dislocation and sprain of joint and ligaments of hip ,171
1749,S74,1749,S74,Injury of nerves at hip and thigh level ,493
1750,S75,1750,S75,Injury of blood vessels at hip and thigh level ,98.2
1751,S76,1751,S76,"Injury of muscle, fascia and tendon at hip and thigh level ",20.4
1752,S77,1752,S77,Crushing injury of hip and thigh ,60.8
1753,S78,1753,S78,Traumatic amputation of hip and thigh ,31.8
1754,S79,1754,S79,Other and unspecified injuries of hip and thigh ,113
1755,S80,1755,S80,Superficial injury of knee and lower leg ,721
1756,S81,1756,S81,Open wound of knee and lower leg ,1890
1757,S82,1757,S82,"Fracture of lower leg, including ankle ",1310
1758,S83,1758,S83,Dislocation and sprain of joints and ligaments of knee ,146
1759,S84,1759,S84,Injury of nerves at lower leg level ,2190
1760,S85,1760,S85,Injury of blood vessels at lower leg level ,1180
1761,S86,1761,S86,"Injury of muscle, fascia and tendon at lower leg level ",40.9
1762,S87,1762,S87,Crushing injury of lower leg ,270
1763,S88,1763,S88,Traumatic amputation of lower leg ,558
1764,S89,1764,S89,Other and unspecified injuries of lower leg ,301
1765,S90,1765,S90,"Superficial injury of ankle, foot and toes ",102
1766,S91,1766,S91,"Open wound of ankle, foot and toes ",510
1767,S92,1767,S92,"Fracture of foot and toe, except ankle ",79.4
1768,S93,1768,S93,"Dislocation and sprain of joints and ligaments at ankle, foot and toe level ",14
1769,S94,1769,S94,Injury of nerves at ankle and foot level ,981
1770,S95,1770,S95,Injury of blood vessels at ankle and foot level ,278
1771,S96,1771,S96,Injury of muscle and tendon at ankle and foot level ,1240
1772,S97,1772,S97,Crushing injury of ankle and foot ,105
1773,S98,1773,S98,Traumatic amputation of ankle and foot ,185
1774,S99,1774,S99,Other and unspecified injuries of ankle and foot ,163
1775,T07,1775,T07,Unspecified multiple injuries ,760
1776,T14,1776,T14,Injury of unspecified body region ,693
1777,T15,1777,T15,Foreign body on external eye ,2910
1778,T16,1778,T16,Foreign body in ear ,5060
1779,T17,1779,T17,Foreign body in respiratory tract ,1150
1780,T18,1780,T18,Foreign body in alimentary tract ,21.6
1781,T19,1781,T19,Foreign body in genitourinary tract ,24.1
1782,T20,1782,T20,"Burn and corrosion of head, face, and neck ",10.9
1783,T21,1783,T21,Burn and corrosion of trunk ,22.4
1784,T22,1784,T22,"Burn and corrosion of shoulder and upper limb, except wrist and hand ",11.6
1785,T23,1785,T23,Burn and corrosion of wrist and hand ,18.8
1786,T24,1786,T24,"Burn and corrosion of lower limb, except ankle and foot ",12.1
1787,T25,1787,T25,Burn and corrosion of ankle and foot ,12.5
1788,T26,1788,T26,Burn and corrosion confined to eye and adnexa ,2.83
1789,T27,1789,T27,Burn and corrosion of respiratory tract ,18.7
1790,T28,1790,T28,Burn and corrosion of other internal organs ,12.3
1791,T30,1791,T30,"Burn and corrosion, body region unspecified ",11.1
1792,T31,1792,T31,Burns classified according to extent of body surface involved ,21
1793,T32,1793,T32,Corrosions classified according to extent of body surface involved ,3.48
1794,T33,1794,T33,Superficial frostbite ,41.7
1795,T34,1795,T34,Frostbite with tissue necrosis ,21.3
1796,T36,1796,T36,"Poisoning by, adverse effect of and underdosing of systemic antibiotics ",2.77
1797,T37,1797,T37,"Poisoning by, adverse effect of and underdosing of other systemic anti- infectives and antiparasitics ",4.98
1798,T38,1798,T38,"Poisoning by, adverse effect of and underdosing of hormones and their synthetic substitutes and antagonists, not elsewhere classified ",9.62
1799,T39,1799,T39,"Poisoning by, adverse effect of and underdosing of nonopioid analgesics, antipyretics and antirheumatics ",8.37
1800,T40,1800,T40,"Poisoning by, adverse effect of and underdosing of narcotics and psychodysleptics [hallucinogens] ",0.049
1801,T41,1801,T41,"Poisoning by, adverse effect of and underdosing of anesthetics and therapeutic gases ",4.32
1802,T42,1802,T42,"Poisoning by, adverse effect of and underdosing of antiepileptic, sedative- hypnotic and antiparkinsonism drugs ",6.36
1803,T43,1803,T43,"Poisoning by, adverse effect of and underdosing of psychotropic drugs, not elsewhere classified ",4.17
1804,T44,1804,T44,"Poisoning by, adverse effect of and underdosing of drugs primarily affecting the autonomic nervous system ",5.43
1805,T45,1805,T45,"Poisoning by, adverse effect of and underdosing of primarily systemic and hematological agents, not elsewhere classified ",4.15
1806,T46,1806,T46,"Poisoning by, adverse effect of and underdosing of agents primarily affecting the cardiovascular system ",3.41
1807,T47,1807,T47,"Poisoning by, adverse effect of and underdosing of agents primarily affecting the gastrointestinal system ",3.88
1808,T48,1808,T48,"Poisoning by, adverse effect of and underdosing of agents primarily acting on smooth and skeletal muscles and the respiratory system ",6.64
1809,T49,1809,T49,"Poisoning by, adverse effect of and underdosing of topical agents primarily affecting skin and mucous membrane and by ophthalmological, otorhinorlaryngological and dental drugs ",7.97
1810,T50,1810,T50,"Poisoning by, adverse effect of and underdosing of diuretics and other and unspecified drugs, medicaments and biological substances ",0.046
1811,T51,1811,T51,Toxic effect of alcohol ,4740
1812,T52,1812,T52,Toxic effect of organic solvents ,517
1813,T53,1813,T53,Toxic effect of halogen derivatives of aliphatic and aromatic hydrocarbons ,12.2
1814,T54,1814,T54,Toxic effect of corrosive substances ,191
1815,T55,1815,T55,Toxic effect of soaps and detergents ,53.1
1816,T56,1816,T56,Toxic effect of metals ,2950
1817,T57,1817,T57,Toxic effect of other inorganic substances ,337
1818,T58,1818,T58,Toxic effect of carbon monoxide ,964
1819,T59,1819,T59,"Toxic effect of other gases, fumes and vapors ",30.8
1820,T60,1820,T60,Toxic effect of pesticides ,2300
1821,T61,1821,T61,Toxic effect of noxious substances eaten as seafood ,5.26
1822,T62,1822,T62,Toxic effect of other noxious substances eaten as food ,12.5
1823,T63,1823,T63,Toxic effect of contact with venomous animals and plants ,28.6
1824,T64,1824,T64,Toxic effect of aflatoxin and other mycotoxin food contaminants ,12.2
1825,T65,1825,T65,Toxic effect of other and unspecified substances ,26
1826,T66,1826,T66,"Radiation sickness, unspecified ",19.4
1827,T67,1827,T67,Effects of heat and light ,21500
1828,T68,1828,T68,Hypothermia ,4170
1829,T69,1829,T69,Other effects of reduced temperature ,4210
1830,T70,1830,T70,Effects of air pressure and water pressure ,17900
1831,T71,1831,T71,Asphyxiation ,1770
1832,T73,1832,T73,Effects of other deprivation ,4710
1833,T74,1833,T74,"Adult and child abuse, neglect and other maltreatment, confirmed ",16.1
1834,T75,1834,T75,Other and unspecified effects of other external causes ,312
1835,T76,1835,T76,"Adult and child abuse, neglect and other maltreatment, suspected ",55.7
1836,T78,1836,T78,"Adverse effects, not elsewhere classified ",194
1837,T79,1837,T79,"Certain early complications of trauma, not elsewhere classified ",8.9
1838,T80,1838,T80,"Complications following infusion, transfusion and therapeutic injection ",20.2
1839,T81,1839,T81,"Complications of procedures, not elsewhere classified ",89.9
1840,T82,1840,T82,"Complications of cardiac and vascular prosthetic devices, implants and grafts ",55.6
1841,T83,1841,T83,"Complications of genitourinary prosthetic devices, implants and grafts ",55.3
1842,T84,1842,T84,"Complications of internal orthopedic prosthetic devices, implants and grafts ",57.5
1843,T85,1843,T85,"Complications of other internal prosthetic devices, implants and grafts ",55.8
1844,T86,1844,T86,Complications of transplanted organs and tissue ,51.4
1845,T87,1845,T87,Complications peculiar to reattachment and amputation ,2.3
1846,T88,1846,T88,"Other complications of surgical and medical care, not elsewhere classified ",84.2
1847,V00,1847,V00,Pedestrian conveyance accident ,28.5
1848,V01,1848,V01,Pedestrian injured in collision with pedal cycle ,12.7
1849,V02,1849,V02,Pedestrian injured in collision with two- or three-wheeled motor vehicle ,3.61
1850,V03,1850,V03,"Pedestrian injured in collision with car, pick-up truck or van ",11.5
1851,V04,1851,V04,Pedestrian injured in collision with heavy transport vehicle or bus ,14.2
1852,V05,1852,V05,Pedestrian injured in collision with railway train or railway vehicle ,15.5
1853,V06,1853,V06,Pedestrian injured in collision with other nonmotor vehicle ,2.88
1854,V09,1854,V09,Pedestrian injured in other and unspecified transport accidents ,11.8
1855,V10,1855,V10,Pedal cycle rider injured in collision with pedestrian or animal ,9.35
1856,V11,1856,V11,Pedal cycle rider injured in collision with other pedal cycle ,5.38
1857,V12,1857,V12,Pedal cycle rider injured in collision with two- or three-wheeled motor vehicle ,2
1858,V13,1858,V13,"Pedal cycle rider injured in collision with car, pick-up truck or van ",29
1859,V14,1859,V14,Pedal cycle rider injured in collision with heavy transport vehicle or bus ,6.36
1860,V15,1860,V15,Pedal cycle rider injured in collision with railway train or railway vehicle ,10.3
1861,V16,1861,V16,Pedal cycle rider injured in collision with other nonmotor vehicle ,2.03
1862,V17,1862,V17,Pedal cycle rider injured in collision with fixed or stationary object ,7.16
1863,V18,1863,V18,Pedal cycle rider injured in noncollision transport accident ,2.53
1864,V19,1864,V19,Pedal cycle rider injured in other and unspecified transport accidents ,4.62
1865,V20,1865,V20,Motorcycle rider injured in collision with pedestrian or animal ,13
1866,V21,1866,V21,Motorcycle rider injured in collision with pedal cycle ,12.6
1867,V22,1867,V22,Motorcycle rider injured in collision with two- or three-wheeled motor vehicle ,2.77
1868,V23,1868,V23,"Motorcycle rider injured in collision with car, pick-up truck or van ",35.1
1869,V24,1869,V24,Motorcycle rider injured in collision with heavy transport vehicle or bus ,39.3
1870,V25,1870,V25,Motorcycle rider injured in collision with railway train or railway vehicle ,33.1
1871,V26,1871,V26,Motorcycle rider injured in collision with other nonmotor vehicle ,2.84
1872,V27,1872,V27,Motorcycle rider injured in collision with fixed or stationary object ,4.46
1873,V28,1873,V28,Motorcycle rider injured in noncollision transport accident ,2.47
1874,V29,1874,V29,Motorcycle rider injured in other and unspecified transport accidents ,9.15
1875,V30,1875,V30,Occupant of three-wheeled motor vehicle injured in collision with pedestrian or animal ,2.19
1876,V31,1876,V31,Occupant of three-wheeled motor vehicle injured in collision with pedal cycle ,1.99
1877,V32,1877,V32,Occupant of three-wheeled motor vehicle injured in collision with two- or three-wheeled motor vehicle ,3.61
1878,V33,1878,V33,"Occupant of three-wheeled motor vehicle injured in collision with car, pick-up truck or van ",2.05
1879,V34,1879,V34,Occupant of three-wheeled motor vehicle injured in collision with heavy transport vehicle or bus ,2.04
1880,V35,1880,V35,Occupant of three-wheeled motor vehicle injured in collision with railway train or railway vehicle ,2
1881,V36,1881,V36,Occupant of three-wheeled motor vehicle injured in collision with other nonmotor vehicle ,1.96
1882,V37,1882,V37,Occupant of three-wheeled motor vehicle injured in collision with fixed or stationary object ,2.04
1883,V38,1883,V38,Occupant of three-wheeled motor vehicle injured in noncollision transport accident ,1.98
1884,V39,1884,V39,Occupant of three-wheeled motor vehicle injured in other and unspecified transport accidents ,2.99
1885,V40,1885,V40,Car occupant injured in collision with pedestrian or animal ,12.9
1886,V41,1886,V41,Car occupant injured in collision with pedal cycle ,11.6
1887,V42,1887,V42,Car occupant injured in collision with two- or three-wheeled motor vehicle ,2.44
1888,V43,1888,V43,"Car occupant injured in collision with car, pick-up truck or van ",12.3
1889,V44,1889,V44,Car occupant injured in collision with heavy transport vehicle or bus ,11.7
1890,V45,1890,V45,Car occupant injured in collision with railway train or railway vehicle ,12
1891,V46,1891,V46,Car occupant injured in collision with other nonmotor vehicle ,2.32
1892,V47,1892,V47,Car occupant injured in collision with fixed or stationary object ,11.8
1893,V48,1893,V48,Car occupant injured in noncollision transport accident ,3.64
1894,V49,1894,V49,Car occupant injured in other and unspecified transport accidents ,8.75
1895,V50,1895,V50,Occupant of pick-up truck or van injured in collision with pedestrian or animal ,10.4
1896,V51,1896,V51,Occupant of pick-up truck or van injured in collision with pedal cycle ,6.39
1897,V52,1897,V52,Occupant of pick-up truck or van injured in collision with two- or three-wheeled motor vehicle ,2.31
1898,V53,1898,V53,"Occupant of pick-up truck or van injured in collision with car, pick-up truck or van ",11.6
1899,V54,1899,V54,Occupant of pick-up truck or van injured in collision with heavy transport vehicle or bus ,10.5
1900,V55,1900,V55,Occupant of pick-up truck or van injured in collision with railway train or railway vehicle ,8.88
1901,V56,1901,V56,Occupant of pick-up truck or van injured in collision with other nonmotor vehicle ,2.03
1902,V57,1902,V57,Occupant of pick-up truck or van injured in collision with fixed or stationary object ,7.7
1903,V58,1903,V58,Occupant of pick-up truck or van injured in noncollision transport accident ,2.7
1904,V59,1904,V59,Occupant of pick-up truck or van injured in other and unspecified transport accidents ,5.61
1905,V60,1905,V60,Occupant of heavy transport vehicle injured in collision with pedestrian or animal ,11.5
1906,V61,1906,V61,Occupant of heavy transport vehicle injured in collision with pedal cycle ,9.94
1907,V62,1907,V62,Occupant of heavy transport vehicle injured in collision with two- or three-wheeled motor vehicle ,2.17
1908,V63,1908,V63,"Occupant of heavy transport vehicle injured in collision with car, pick-up truck or van ",7.8
1909,V64,1909,V64,Occupant of heavy transport vehicle injured in collision with heavy transport vehicle or bus ,5.71
1910,V65,1910,V65,Occupant of heavy transport vehicle injured in collision with railway train or railway vehicle ,11.7
1911,V66,1911,V66,Occupant of heavy transport vehicle injured in collision with other nonmotor vehicle ,2.15
1912,V67,1912,V67,Occupant of heavy transport vehicle injured in collision with fixed or stationary object ,11.2
1913,V68,1913,V68,Occupant of heavy transport vehicle injured in noncollision transport accident ,2.22
1914,V69,1914,V69,Occupant of heavy transport vehicle injured in other and unspecified transport accidents ,7.55
1915,V70,1915,V70,Bus occupant injured in collision with pedestrian or animal ,12.8
1916,V71,1916,V71,Bus occupant injured in collision with pedal cycle ,9.21
1917,V72,1917,V72,Bus occupant injured in collision with two- or three-wheeled motor vehicle ,2.23
1918,V73,1918,V73,"Bus occupant injured in collision with car, pick-up truck or van ",11.9
1919,V74,1919,V74,Bus occupant injured in collision with heavy transport vehicle or bus ,12
1920,V75,1920,V75,Bus occupant injured in collision with railway train or railway vehicle ,11.8
1921,V76,1921,V76,Bus occupant injured in collision with other nonmotor vehicle ,2.62
1922,V77,1922,V77,Bus occupant injured in collision with fixed or stationary object ,11.1
1923,V78,1923,V78,Bus occupant injured in noncollision transport accident ,2.08
1924,V79,1924,V79,Bus occupant injured in other and unspecified transport accidents ,7.2
1925,V80,1925,V80,Animal-rider or occupant of animal-drawn vehicle injured in transport accident ,5.2
1926,V81,1926,V81,Occupant of railway train or railway vehicle injured in transport accident ,12
1927,V82,1927,V82,Occupant of powered streetcar injured in transport accident ,4.29
1928,V83,1928,V83,Occupant of special vehicle mainly used on industrial premises injured in transport accident ,11.6
1929,V84,1929,V84,Occupant of special vehicle mainly used in agriculture injured in transport accident ,11.9
1930,V85,1930,V85,Occupant of special construction vehicle injured in transport accident ,6.58
1931,V86,1931,V86,"Occupant of special all-terrain or other off-road motor vehicle, injured in transport accident ",4.36
1932,V87,1932,V87,Traffic accident of specified type but victim's mode of transport unknown ,9.53
1933,V88,1933,V88,Nontraffic accident of specified type but victim's mode of transport unknown ,3.81
1934,V89,1934,V89,"Motor- or nonmotor-vehicle accident, type of vehicle unspecified ",3.26
1935,V90,1935,V90,Drowning and submersion due to accident to watercraft ,3.75
1936,V91,1936,V91,Other injury due to accident to watercraft ,24
1937,V92,1937,V92,"Drowning and submersion due to accident on board watercraft, without accident to watercraft ",2.27
1938,V93,1938,V93,"Other injury due to accident on board watercraft, without accident to watercraft ",6.47
1939,V94,1939,V94,Other and unspecified water transport accidents ,13.5
1940,V95,1940,V95,Accident to powered aircraft causing injury to occupant ,12.4
1941,V96,1941,V96,Accident to nonpowered aircraft causing injury to occupant ,2.3
1942,V97,1942,V97,Other specified air transport accidents ,156
1943,V98,1943,V98,Other specified transport accidents ,349
1944,V99,1944,V99,Unspecified transport accident ,72.7
1945,W00,1945,W00,Fall due to ice and snow ,7590
1946,W01,1946,W01,"Fall on same level from slipping, tripping and stumbling ",17.7
1947,W03,1947,W03,Other fall on same level due to collision with another person ,305
1948,W04,1948,W04,Fall while being carried or supported by other persons ,509
1949,W05,1949,W05,"Fall from non-moving wheelchair, nonmotorized scooter and motorized mobility scooter ",2.54
1950,W06,1950,W06,Fall from bed ,49300
1951,W07,1951,W07,Fall from chair ,38800
1952,W08,1952,W08,Fall from other furniture ,25000
1953,W09,1953,W09,Fall on and from playground equipment ,3760
1954,W10,1954,W10,Fall on and from stairs and steps ,4250
1955,W11,1955,W11,Fall on and from ladder ,15700
1956,W12,1956,W12,Fall on and from scaffolding ,2270
1957,W13,1957,W13,"Fall from, out of or through building or structure ",19100
1958,W14,1958,W14,Fall from tree ,50100
1959,W15,1959,W15,Fall from cliff ,21800
1960,W16,1960,W16,"Fall, jump or diving into water ",1580
1961,W17,1961,W17,Other fall from one level to another ,25200
1962,W18,1962,W18,"Other slipping, tripping and stumbling and falls ",13
1963,W19,1963,W19,Unspecified fall ,2170
1964,W20,1964,W20,"Struck by thrown, projected or falling object ",16.9
